{
  "schema_version": "1.0",
  "kind": "task",
  "task_id": "kit-empty-task",
  "task_version": "1",
  "repository": {
    "source": "https",
    "url": "https://example.com/kit-fixture.git",
    "commit": "0123456789abcdef0123456789abcdef01234567"
  },
  "specification_digest": "sha256:0000000000000000000000000000000000000000000000000000000000000000",
  "scaffold_digest": "sha256:1111111111111111111111111111111111111111111111111111111111111111"
}
